{
  "schema_version": 1,
  "kind": "algorithm",
  "reference": {
    "oracle": "pinned_nvidia_python",
    "nemo_commit": "b331a34885986ec879ca7acb62d955e7af71c015",
    "model_repository": "nvidia/parakeet-tdt_ctc-0.6b-ja",
    "model_revision": "44edb27eea9317daf89333e75eb830db4b1cc298",
    "decoding_strategy": "BeamBatchedCTCInfer",
    "parameters": {
      "blank_id": 3,
      "beam_size": 4,
      "beam_beta": 0.0,
      "beam_threshold": 20.0,
      "fusion_models": null
    }
  },
  "input": {
    "sha256": "efa2e31e8219eda23f422fcf51d86d8866e369be039c1cb1ab20c92c51908b3b",
    "shape": [
      6,
      4
    ],
    "log_probs": [
      -0.7463173270225525,
      -1.946317195892334,
      -3.446317434310913,
      -1.0463173389434814,
      -1.4211113452911377,
      -0.7211112380027771,
      -2.9211113452911377,
      -1.521111249923706,
      -1.3674261569976807,
      -0.767426073551178,
      -2.0674262046813965,
      -1.8674261569976807,
      -3.0524160861968994,
      -1.7524158954620361,
      -0.652415931224823,
      -1.3524160385131836,
      -1.7558050155639648,
      -2.355804920196533,
      -1.055804967880249,
      -0.9558050036430359,
      -0.7179396748542786,
      -2.9179396629333496,
      -1.8179397583007812,
      -1.217939853668213
    ]
  },
  "output": {
    "token_ids": [
      0,
      1,
      2,
      0
    ],
    "score": -4.561015605926514
  },
  "environment": {
    "torch": "2.12.0+cpu"
  }
}
