{
  "schema_version": 1,
  "kind": "streaming",
  "reference": {
    "oracle": "pinned_nvidia_python",
    "nemo_commit": "b331a34885986ec879ca7acb62d955e7af71c015",
    "model_repository": "nvidia/nemotron-3.5-asr-streaming-0.6b",
    "model_revision": "1c8deaecc64b91f034d73e08dd8b64625eb3395d",
    "runtime": "onnxruntime-1.24.4",
    "decoding_strategy": "NVIDIA RNNT greedy, production streaming ONNX",
    "parameters": {
      "max_symbols_per_frame": 10
    }
  },
  "input": {
    "sha256": "460bd8dccb0d2a5f4e29c628f837be4082d13defc64c3fc21dd1b6bb0e119095",
    "sample_rate_hz": 16000,
    "samples": 115200,
    "chunk_samples": 2560,
    "model_dir": "sherpa-onnx-nemotron-3.5-asr-streaming-0.6b-560ms-int8-2026-06-11"
  },
  "output": {
    "text": "うちの中学は弁当性で持っていけない場合は五十円の学校販売のパンを買う",
    "token_ids": [
      3451, 7449, 7485, 7404, 7424, 7472, 6645, 7380, 7255, 7480, 7274, 7479,
      7478, 7488, 7453, 7482, 7488, 7351, 7346, 7472, 7284, 7378, 7094, 7485,
      7424, 7338, 6764, 7183, 7485, 7369, 7460, 7456, 7206, 7484
    ],
    "timestamps": [
      8, 10, 11, 14, 16, 18, 21, 23, 26, 28, 33, 35, 35, 36, 38, 39, 40, 42, 43,
      46, 49, 51, 54, 57, 58, 61, 64, 66, 68, 70, 71, 72, 73, 75
    ],
    "partials": [
      "",
      "",
      "",
      "",
      "",
      "",
      "",
      "うちの",
      "うちの",
      "うちの",
      "うちの",
      "うちの中学は",
      "うちの中学は",
      "うちの中学は",
      "うちの中学は弁当性",
      "うちの中学は弁当性",
      "うちの中学は弁当性",
      "うちの中学は弁当性",
      "うちの中学は弁当性で持",
      "うちの中学は弁当性で持",
      "うちの中学は弁当性で持",
      "うちの中学は弁当性で持っていけない",
      "うちの中学は弁当性で持っていけない",
      "うちの中学は弁当性で持っていけない",
      "うちの中学は弁当性で持っていけない",
      "うちの中学は弁当性で持っていけない場合は",
      "うちの中学は弁当性で持っていけない場合は",
      "うちの中学は弁当性で持っていけない場合は",
      "うちの中学は弁当性で持っていけない場合は五十円",
      "うちの中学は弁当性で持っていけない場合は五十円",
      "うちの中学は弁当性で持っていけない場合は五十円",
      "うちの中学は弁当性で持っていけない場合は五十円",
      "うちの中学は弁当性で持っていけない場合は五十円の学校",
      "うちの中学は弁当性で持っていけない場合は五十円の学校",
      "うちの中学は弁当性で持っていけない場合は五十円の学校",
      "うちの中学は弁当性で持っていけない場合は五十円の学校販売の",
      "うちの中学は弁当性で持っていけない場合は五十円の学校販売の",
      "うちの中学は弁当性で持っていけない場合は五十円の学校販売の",
      "うちの中学は弁当性で持っていけない場合は五十円の学校販売の",
      "うちの中学は弁当性で持っていけない場合は五十円の学校販売のパンを買う",
      "うちの中学は弁当性で持っていけない場合は五十円の学校販売のパンを買う",
      "うちの中学は弁当性で持っていけない場合は五十円の学校販売のパンを買う",
      "うちの中学は弁当性で持っていけない場合は五十円の学校販売のパンを買う",
      "うちの中学は弁当性で持っていけない場合は五十円の学校販売のパンを買う",
      "うちの中学は弁当性で持っていけない場合は五十円の学校販売のパンを買う"
    ],
    "encoder_frames": 84,
    "window_frames": 65,
    "shift_frames": 56,
    "prompt_id": 101
  }
}
