{
  "schema_version": 1,
  "kind": "audio",
  "reference": {
    "oracle": "pinned_nvidia_python",
    "nemo_commit": "b331a34885986ec879ca7acb62d955e7af71c015",
    "model_repository": "nvidia/nemotron-3.5-asr-streaming-0.6b",
    "model_revision": "1c8deaecc64b91f034d73e08dd8b64625eb3395d",
    "decoding_strategy": "model_default",
    "parameters": {}
  },
  "input": {
    "sha256": "460bd8dccb0d2a5f4e29c628f837be4082d13defc64c3fc21dd1b6bb0e119095",
    "sample_rate_hz": 16000,
    "samples": 115200,
    "provenance": "Nemotron 3.5 archive ja.wav"
  },
  "output": {
    "text": "うちの中学は弁当性で持っていけない場合は五十円の学校販売のパンを買う",
    "token_ids": [
      3451,
      7449,
      7485,
      7404,
      7424,
      7472,
      6645,
      7380,
      7255,
      7480,
      7274,
      7479,
      7478,
      7488,
      7453,
      7482,
      7488,
      7351,
      7346,
      7472,
      7284,
      7378,
      7094,
      7485,
      7424,
      7338,
      6764,
      7183,
      7485,
      7369,
      7460,
      7456,
      7206,
      7484
    ],
    "score": -2.6232309341430664,
    "timestamps": [
      10,
      13,
      14,
      16,
      18,
      20,
      24,
      25,
      28,
      31,
      36,
      38,
      38,
      39,
      41,
      42,
      43,
      44,
      46,
      48,
      52,
      54,
      56,
      60,
      61,
      64,
      66,
      68,
      71,
      72,
      74,
      75,
      77,
      80
    ],
    "token_durations": []
  },
  "environment": {
    "python": "3.11.14",
    "nemo": "3.1.0+b331a3488",
    "torch": "2.12.0+cpu",
    "device": "cpu"
  }
}
