{
  "schema_version": 1,
  "kind": "streaming",
  "reference": {
    "oracle": "pinned_nvidia_python",
    "nemo_commit": "b331a34885986ec879ca7acb62d955e7af71c015",
    "model_repository": "nvidia/nemotron-3.5-asr-streaming-0.6b",
    "model_revision": "1c8deaecc64b91f034d73e08dd8b64625eb3395d",
    "runtime": "onnxruntime-1.24.4",
    "decoding_strategy": "NVIDIA RNNT greedy, production streaming ONNX",
    "parameters": {
      "max_symbols_per_frame": 10
    }
  },
  "input": {
    "sha256": "460bd8dccb0d2a5f4e29c628f837be4082d13defc64c3fc21dd1b6bb0e119095",
    "sample_rate_hz": 16000,
    "samples": 115200,
    "chunk_samples": 2560,
    "model_dir": "sherpa-onnx-nemotron-3.5-asr-streaming-0.6b-160ms-int8-2026-06-11"
  },
  "output": {
    "text": "うちの中学は弁当性で持っていけない場合は五十円の学校販売のパンを買う",
    "token_ids": [
      3451, 7449, 7485, 7404, 7424, 7472, 6645, 7380, 7255, 7480, 7274, 7479,
      7478, 7488, 7453, 7482, 7488, 7351, 7346, 7472, 7284, 7378, 7094, 7485,
      7424, 7338, 6764, 7183, 7485, 7369, 7460, 7456, 7206, 7484
    ],
    "timestamps": [
      9, 12, 13, 14, 17, 19, 22, 23, 26, 29, 34, 36, 36, 37, 39, 40, 41, 43, 44,
      46, 50, 52, 54, 58, 60, 62, 64, 67, 69, 70, 72, 74, 76, 78
    ],
    "partials": [
      "",
      "",
      "",
      "",
      "",
      "う",
      "う",
      "うちの",
      "うちの中",
      "うちの中学",
      "うちの中学は",
      "うちの中学は",
      "うちの中学は弁当",
      "うちの中学は弁当",
      "うちの中学は弁当性",
      "うちの中学は弁当性で",
      "うちの中学は弁当性で",
      "うちの中学は弁当性で",
      "うちの中学は弁当性で持",
      "うちの中学は弁当性で持ってい",
      "うちの中学は弁当性で持っていけ",
      "うちの中学は弁当性で持っていけない",
      "うちの中学は弁当性で持っていけない場",
      "うちの中学は弁当性で持っていけない場合",
      "うちの中学は弁当性で持っていけない場合は",
      "うちの中学は弁当性で持っていけない場合は",
      "うちの中学は弁当性で持っていけない場合は五",
      "うちの中学は弁当性で持っていけない場合は五十",
      "うちの中学は弁当性で持っていけない場合は五十円",
      "うちの中学は弁当性で持っていけない場合は五十円",
      "うちの中学は弁当性で持っていけない場合は五十円の",
      "うちの中学は弁当性で持っていけない場合は五十円の学",
      "うちの中学は弁当性で持っていけない場合は五十円の学校",
      "うちの中学は弁当性で持っていけない場合は五十円の学校販",
      "うちの中学は弁当性で持っていけない場合は五十円の学校販売",
      "うちの中学は弁当性で持っていけない場合は五十円の学校販売の",
      "うちの中学は弁当性で持っていけない場合は五十円の学校販売のパ",
      "うちの中学は弁当性で持っていけない場合は五十円の学校販売のパン",
      "うちの中学は弁当性で持っていけない場合は五十円の学校販売のパンを",
      "うちの中学は弁当性で持っていけない場合は五十円の学校販売のパンを買",
      "うちの中学は弁当性で持っていけない場合は五十円の学校販売のパンを買う",
      "うちの中学は弁当性で持っていけない場合は五十円の学校販売のパンを買う",
      "うちの中学は弁当性で持っていけない場合は五十円の学校販売のパンを買う",
      "うちの中学は弁当性で持っていけない場合は五十円の学校販売のパンを買う",
      "うちの中学は弁当性で持っていけない場合は五十円の学校販売のパンを買う"
    ],
    "encoder_frames": 88,
    "window_frames": 25,
    "shift_frames": 16,
    "prompt_id": 101
  }
}
