{
  "schema_version": 1,
  "kind": "audio",
  "reference": {
    "oracle": "pinned_nvidia_python",
    "nemo_commit": "b331a34885986ec879ca7acb62d955e7af71c015",
    "model_repository": "nvidia/parakeet-tdt_ctc-0.6b-ja",
    "model_revision": "44edb27eea9317daf89333e75eb830db4b1cc298",
    "decoding_strategy": "model_default",
    "parameters": {}
  },
  "input": {
    "sha256": "460bd8dccb0d2a5f4e29c628f837be4082d13defc64c3fc21dd1b6bb0e119095",
    "sample_rate_hz": 16000,
    "samples": 115200,
    "provenance": "sherpa-test_wavs-ja.wav"
  },
  "output": {
    "text": "うちの中学は弁当制で持っていけない場合は50円の学校販売のパンを買う。",
    "token_ids": [
      2,
      629,
      3,
      51,
      438,
      7,
      1204,
      261,
      487,
      9,
      327,
      17,
      12,
      67,
      37,
      887,
      7,
      894,
      453,
      3,
      964,
      2013,
      752,
      3,
      845,
      5,
      810,
      49,
      1
    ],
    "score": -2123.49951171875,
    "timestamps": [
      0,
      3,
      5,
      8,
      11,
      14,
      16,
      19,
      22,
      25,
      28,
      30,
      32,
      34,
      36,
      39,
      42,
      46,
      50,
      52,
      55,
      59,
      62,
      64,
      67,
      70,
      72,
      76,
      80
    ]
  },
  "environment": {
    "python": "3.11.14",
    "nemo": "3.1.0+b331a3488",
    "torch": "2.12.0+cpu",
    "device": "cpu"
  }
}
